{
  "Dispatch Approved By": "noc.borealis",
  "Accepted At": "2026-09-27T20:35:21Z",
  "Assigned Tech": "tech.borealis",
  "Summary": "Locate and splice fiber break on FIB-MSP-STP-01 (I-94 corridor)",
  "Dispatched At": "2026-09-27T20:35:20Z",
  "Latitude": "44.95400",
  "Incident ID": "INC-20260927-230D",
  "State": "Work Complete",
  "Priority": "P1",
  "Safety Notes": "Live traffic — Class 3 vest, cones, flagger required on shoulder",
  "ETA": "2026-09-27T21:30:21Z",
  "Replay Batch": "demo-202609272031",
  "Arrived At": "2026-09-27T20:35:22Z",
  "Tenant ID": "borealis",
  "Completion Criteria": "All 144 fibers spliced; OTDR trace on each lit fiber < 0.1 dB per splice; NOC confirms rx power within 3 dB of baseline on all 8 channels and OTU LOF cleared",
  "Completed At": "2026-09-27T20:35:30Z",
  "Access Instructions": "MnDOT right-of-way permit on file (#R-22817); park on Concordia Ave frontage road",
  "Work Type": "Fiber Repair",
  "Longitude": "-93.12100",
  "Parts": "[{\"partId\":\"PRT-SPLICE-144\",\"qty\":2,\"reservation\":\"RSV-WO-20260927-230D-ECF1-PRT-SPLICE-144\"},{\"partId\":\"PRT-FIBER-288-1KM\",\"qty\":1,\"reservation\":\"RSV-WO-20260927-230D-ECF1-PRT-FIBER-288-1KM\"},{\"partId\":\"PRT-OTDR-KIT\",\"qty\":1,\"reservation\":\"RSV-WO-20260927-230D-ECF1-PRT-OTDR-KIT\"}]",
  "Site ID": "SITE-FH-I94-09",
  "Location Description": "OTDR from ROADM-MSP-01 OTS-2: event at 9.41 km (±30 m) → I-94 right-of-way near Lexington Pkwy; nearest hut SITE-FH-I94-09",
  "Resource ID": "FIB-MSP-STP-01",
  "Evidence": "[{\"type\":\"OTDR\",\"ref\":\"otdr-FIB-MSP-STP-01-post.sor\"},{\"type\":\"Photo\",\"ref\":\"splice-km9.4.jpg\"}]",
  "Work Order ID": "WO-20260927-230D-ECF1",
  "Findings": "Backhoe cut at I-94 km 9.41 during unpermitted sound-wall footing work; 144F cable severed.",
  "Crew": "East Metro fiber crew 2",
  "Completion Notes": "30 m of 288F placed; 144/144 spliced, avg 0.03 dB"
}